Genre,Title,Audience Score,Critics Score,Synopsis,Director
biography,Oppenheimer,91,93,"During World War II, Lt. Gen. Leslie Groves Jr. appoints physicist J. Robert Oppenheimer to work on the top-secret Manhattan Project. Oppenheimer and a team of scientists spend years developing and designing the atomic bomb. Their work comes to fruition on July 16, 1945, as they witness the world's first nuclear explosion, forever changing the course of history.",Christopher Nolan
biography,Bob Marley: One Love,92,44,"BOB MARLEY: ONE LOVE celebrates the life and music of an icon who inspired generations through his message of love and unity. On the big screen for the first time, discover Bob's powerful story of overcoming adversity and the journey behind his revolutionary music.",Reinaldo Marcus Green
biography,The Boys in the Boat,97,58,"The Boys in the Boat is a sports drama based on the #1 New York Times bestselling non-fiction novel written by Daniel James Brown. The film, directed by George Clooney, is about the 1936 University of Washington rowing team that competed for gold at the Summer Olympics in Berlin. This inspirational true story follows a group of underdogs at the height of the Great Depression as they are thrust into the spotlight and take on elite rivals from around the world.",George Clooney
biography,Napoleon,59,57,"""Napoleon"" is a spectacle-filled action epic that details the checkered rise and fall of the iconic French Emperor Napoleon Bonaparte, played by Oscar winner Joaquin Phoenix. Against a stunning backdrop of large-scale filmmaking orchestrated by legendary director Ridley Scott, the film captures Bonaparte's relentless journey to power through the prism of his addictive, volatile relationship with his one true love, Josephine, showcasing his visionary military and political tactics against some of the most dynamic practical battle sequences ever filmed.",Ridley Scott
biography,Scoop,62,77,"Inspired by real events, SCOOP is the inside account of the tenacious journalism that landed an earthshattering interview -- Prince Andrew's infamous BBC Newsnight appearance. From the tension of producer Sam McAlister's high stakes negotiations with Buckingham Palace, all the way to Emily Maitlis' jaw-dropping, forensic showdown with the Prince, SCOOP takes us inside the story, with the women who would stop at nothing to get it. To get an interview this big, you have to be bold.",Philip Martin
biography,Catching Fire: The Story of Anita Pallenberg,,80,"Anita Pallenberg was at many points in her life a newspaper headline: a ""rock n' roll goddess,"" a ""voodoo priestess,"" and an ""evil seductress."" She was accused of trying to break up the Rolling Stones, among other things. But those who loved her considered her an exciting cultural force, and a loving mother -- and innocent of the accusations. Never-seen-before home movies and family photographs explore life with the Rolling Stones and tell a bittersweet tale of both triumph and heartbreak. From Barbarella to the Swiss Alps, and the Lower East Side to London, Anita Pallenberg was a creative force ahead of her time.","Alexis Bloom, Svetlana Zill"
biography,Priscilla,63,84,"When teenage Priscilla Beaulieu meets Elvis Presley at a party, the man who is already a meteoric rock-and-roll superstar becomes someone entirely unexpected in private moments: a thrilling crush, an ally in loneliness, a vulnerable best friend. Through Priscilla’s eyes, Sofia Coppola tells the unseen side of a great American myth in Elvis and Priscilla's long courtship and turbulent marriage, from a German army base to his dream-world estate at Graceland, in this deeply felt and ravishingly detailed portrait of love, fantasy, and fame.",Sofia Coppola
biography,Ford v Ferrari,98,92,"American automotive designer Carroll Shelby and fearless British race car driver Ken Miles battle corporate interference, the laws of physics and their own personal demons to build a revolutionary vehicle for the Ford Motor Co. Together, they plan to compete against the race cars of Enzo Ferrari at the 24 Hours of Le Mans in France in 1966.",James Mangold
biography,King Richard,98,90,"Armed with a clear vision and a brazen 78-page plan, Richard Williams is determined to write his daughters, Venus and Serena, into history. Training on Compton, California's neglected tennis courts--rain or shine--the girls are shaped by their father's unyielding commitment and their mother's balanced perspective and keen intuition, defying the seemingly insurmountable odds and prevailing expectations laid before them. Based on the true story that will inspire the world, ""King Richard"" follows the uplifting journey of a family whose unwavering resolve and unconditional belief ultimately delivers two of the world's greatest sports legends.",Reinaldo Marcus Green
biography,Society of the Snow,88,90,"In 1972, Uruguayan Air Force Flight 571, which had been chartered to fly a rugby team to Chile, crashed in the heart of the Andes. Only 29 of its 45 passengers survived the accident. Trapped in one of the most hostile and inaccessible environments on the planet, they have to resort to extreme measures to stay alive.",J. A. Bayona
biography,Hacksaw Ridge,91,84,"The true story of Pfc. Desmond T. Doss (Andrew Garfield), who won the Congressional Medal of Honor despite refusing to bear arms during WWII on religious grounds. Doss was drafted and ostracized by fellow soldiers for his pacifist stance but went on to earn respect and adoration for his bravery, selflessness and compassion after he risked his life -- without firing a shot -- to save 75 men in the Battle of Okinawa.",Mel Gibson
biography,I Can Only Imagine,91,67,"Growing up in Greenville, Texas, Bart Millard suffers physical and emotional abuse at the hands of his father, Arthur. When Arthur becomes terminally ill, he finds redemption by embracing his faith and rediscovering his love for his son. Years later, Bart's troubled childhood and mended relationship with his dad inspires him to write the hit song ""I Can Only Imagine"" as singer of the Christian band MercyMe.","Andrew Erwin, Jon Erwin"
biography,Molly's Game,84,81,"The true story of Molly Bloom, a beautiful, young, Olympic-class skier who ran the world's most exclusive high-stakes poker game for a decade before being arrested in the middle of the night by 17 FBI agents wielding automatic weapons. Her players included Hollywood royalty, sports stars, business titans and finally, unbeknown to her, the Russian mob. Her only ally was her criminal defense lawyer Charlie Jaffey, who learned there was much more to Molly than the tabloids led people to believe.",Aaron Sorkin
biography,Beautiful Boy,78,68,"Teenager Nicolas Sheff seems to have it all -- good grades, editor of the school newspaper, actor, artist and athlete. When Nic's addiction to meth threatens to destroy him, his desperate father does whatever he can to save his son and his family.",Felix van Groeningen
biography,The King,83,71,"Young Henry V encounters deceit, war and treachery after becoming king of England in the 15th century.",David Michôd
biography,Elvis,94,77,"The film explores the life and music of Elvis Presley (Austin Butler), seen through the prism of his complicated relationship with his enigmatic manager, Colonel Tom Parker (Tom Hanks). The story delves into the complex dynamic between Presley and Parker spanning over 20 years, from Presley's rise to fame to his unprecedented stardom, against the backdrop of the evolving cultural landscape and loss of innocence in America. Central to that journey is one of the most significant and influential people in Elvis's life, Priscilla Presley (Olivia DeJonge).",Baz Luhrmann
biography,The Imitation Game,91,90,"In 1939, newly created British intelligence agency MI6 recruits Cambridge mathematics alumnus Alan Turing (Benedict Cumberbatch) to crack Nazi codes, including Enigma -- which cryptanalysts had thought unbreakable. Turing's team, including Joan Clarke (Keira Knightley), analyze Enigma messages while he builds a machine to decipher them. Turing and team finally succeed and become heroes, but in 1952, the quiet genius encounters disgrace when authorities reveal he is gay and send him to prison.",Morten Tyldum
biography,Maestro,57,79,"Maestro is a towering and fearless love story chronicling the lifelong relationship between Leonard Bernstein and Felicia Montealegre Cohn Bernstein. A love letter to life and art, Maestro at its core is an emotionally epic portrayal of family and love.",Bradley Cooper
biography,The Greatest Showman,86,57,"Growing up in the early 1800s, P.T. Barnum displays a natural talent for publicity and promotion, selling lottery tickets by age 12. After trying his hands at various jobs, P.T. turns to show business to indulge his limitless imagination, rising from nothing to create the Barnum & Bailey circus. Featuring catchy musical numbers, exotic performers and daring acrobatic feats, Barnum's mesmerizing spectacle soon takes the world by storm to become the greatest show on Earth.",Michael Gracey
biography,Remembering Gene Wilder,100,88,"This loving tribute to Gene Wilder celebrates his life and legacy as the comic genius behind an extraordinary string of film roles, from his first collaboration with Mel Brooks in The Producers, to the enigmatic title role in the original Willy Wonka and the Chocolate Factory, to his inspired on-screen partnership with Richard Pryor in movies like Silver Streak. It is illustrated by a bevy of touching and hilarious clips and outtakes, never-before-seen home movies, narration from Wilder's audiobook memoir, and interviews with a roster of brilliant friends and collaborators like Mel Brooks, Alan Alda, and Carol Kane. Remembering Gene Wilder shines a light on an essential performer, writer, director, and all-around mensch.",Ron Frank
biography,Argo,90,96,"On Nov. 4, 1979, militants storm the U.S. embassy in Tehran, Iran, taking 66 American hostages. Amid the chaos, six Americans manage to slip away and find refuge with the Canadian ambassador. Knowing that it's just a matter of time before the refugees are found and likely executed, the U.S. government calls on extractor Tony Mendez (Ben Affleck) to rescue them. Mendez's plan is to pose as a Hollywood producer scouting locations in Iran and train the refugees to act as his ""film"" crew.",Ben Affleck
biography,Megan Leavey,82,86,"The true life story of Megan Leavey, a young Marine corporal whose unique discipline and bond with a military combat dog saved many lives during her deployment in Iraq. Assigned to clean up the K-9 unit after a disciplinary hearing, Leavey starts to identify with Rex, a particularly aggressive dog that she trains. Over the course of their service, Megan and Rex complete more than 100 missions until an improvised explosive device injures both, putting their fates in jeopardy.",Gabriela Cowperthwaite
comedy,Ghostbusters: Frozen Empire,83,43,"In Ghostbusters: Frozen Empire, the Spengler family returns to where it all started -- the iconic New York City firehouse -- to team up with the original Ghostbusters, who've developed a top-secret research lab to take busting ghosts to the next level. But when the discovery of an ancient artifact unleashes an evil force, Ghostbusters new and old must join forces to protect their home and save the world from a second Ice Age.",Gil Kenan
comedy,Wicked Little Letters,91,79,"A 1920s English seaside town bears witness to a farcical and occasionally sinister scandal in this riotous mystery comedy. Based on a stranger than fiction true story, WICKED LITTLE LETTERS follows two neighbors: deeply conservative local Edith Swan (Olivia Colman) and rowdy Irish migrant Rose Gooding (Jessie Buckley). When Edith and fellow residents begin to receive wicked letters full of unintentionally hilarious profanities, foul-mouthed Rose is charged with the crime. The anonymous letters prompt a national uproar, and a trial ensues. However, as the town's women -- led by Police Officer Gladys Moss (Anjana Vasan) -- begin to investigate the crime themselves, they suspect that something is amiss, and Rose may not be the culprit after all.",Thea Sharrock
comedy,Founders Day,12,46,"In this satirical political slasher from the Bloomquist Brothers, a small town is shaken by a series of ominous killings in the days leading up to a heated mayoral election. As accusations fly and the threat of a masked killer darkens every street corner, the residents must race to uncover the truth before fear consumes the town.",Erik Bloomquist
comedy,Mother of the Bride,23,19,Lana's daughter Emma returns from abroad and drops a bombshell: she's getting married. In Thailand. In a month! Things only get worse when Lana learns that the man who captured Emma's heart is the son of the man who broke hers years ago.,Mark Waters
comedy,The Ministry of Ungentlemanly Warfare,93,71,"Based upon recently declassified files of the British War Department and inspired by true events, THE MINISTRY OF UNGENTLEMANLY WARFARE is an action-comedy that tells the story of the first-ever special forces organization formed during WWII by UK Prime Minister Winston Churchill and a small group of military officials including author Ian Fleming. The top-secret combat unit, composed of a motley crew of rogues and mavericks, goes on a daring mission against the Nazis using entirely unconventional and utterly ""ungentlemanly"" fighting techniques. Ultimately their audacious approach changed the course of the war and laid the foundation for the British SAS and modern Black Ops warfare.",Guy Ritchie
comedy,Foil,,,"After opting out of their high school reunion to reconnect on a desert camping trip, Rex and Dexter realize their intentions for the weekend are at odds. Dexter, a failed filmmaker, hopes to harness a fabled vortex in the area to inspire a movie idea. Rex, a rebellious conspiracy theorist, plans to investigate a rumored UFO crash believed to explain the anomaly. Tensions boil over when they meet an unusually friendly camper who claims to have found some wreckage from the crash: a mysterious piece of shiny foil.",Zach Green
comedy,Unfrosted,55,39,"Michigan, 1963. Kellogg's and Post, sworn cereal rivals, race to create a pastry that will change the face of breakfast forever. A tale of ambition, betrayal, sugar, and menacing milkmen, Unfrosted stars writer/director Jerry Seinfeld.",Jerry Seinfeld
comedy,The Idea of You,69,83,"Based on the acclaimed, contemporary love story of the same name, The Idea of You centers on Solène (Anne Hathaway), a 40-year-old single mom who begins an unexpected romance with 24-year-old Hayes Campbell (Nicholas Galitzine), the lead singer of August Moon, the hottest boy band on the planet. When Solène must step in to chaperone her teenage daughter's trip to the Coachella Music Festival after her ex bails at the last minute, she has a chance encounter with Hayes and there is an instant, undeniable spark. As they begin a whirlwind romance, it isn't long before Hayes' superstar status poses unavoidable challenges to their relationship, and Solène soon discovers that life in the glare of his spotlight might be more than she bargained for.",Michael Showalter
comedy,"LaRoy, Texas",62,100,"Broke and depressed, Ray (John Magaro) is mistaken for a dangerous hitman and given an envelope of cash. Along with his P.I. friend Skip (Steve Zahn), he must escape the actual hitman to make it out of LaRoy alive.",Shane Atkinson
comedy,Anyone But You,87,54,"In the edgy comedy Anyone But You, Bea (Sydney Sweeney) and Ben (Glen Powell) look like the perfect couple, but after an amazing first date something happens that turns their fiery hot attraction ice cold -- until they find themselves unexpectedly thrust together at a destination wedding in Australia. So they do what any two mature adults would do: pretend to be a couple.",Will Gluck
comedy,Miller's Girl,42,29,"A talented young writer (Jenna Ortega) embarks on a creative odyssey when her teacher (Martin Freeman) assigns a project that entangles them both in an increasingly complex web. As lines blur and their lives intertwine, professor and protégé must confront their darkest selves while straining to preserve their individual sense of purpose and the things they hold most dear.",Jade Halley Bartlett
comedy,Katt Williams: Woke Foke,28,,Comedian Katt Williams lets loose in real time as he hits the stage on May 4 for Netflix’s second livestreamed stand-up event.,N/A
comedy,Argylle,72,33,"Bryce Dallas Howard (Jurassic World franchise) is Elly Conway, the reclusive author of a series of best-selling espionage novels, whose idea of bliss is a night at home with her computer and her cat, Alfie. But when the plots of Elly's fictional books--which center on secret agent Argylle and his mission to unravel a global spy syndicate--begin to mirror the covert actions of a real-life spy organization, quiet evenings at home become a thing of the past. Accompanied by Aidan (Oscar® winner Sam Rockwell), a cat-allergic spy, Elly (carrying Alfie in her backpack) races across the world to stay one step ahead of the killers as the line between Elly's fictional world and her real one begins to blur.",Matthew Vaughn
comedy,The Holdovers,92,97,"From acclaimed director Alexander Payne, THE HOLDOVERS follows a curmudgeonly instructor (Paul Giamatti) at a New England prep school who is forced to remain on campus during Christmas break to babysit the handful of students with nowhere to go. Eventually he forms an unlikely bond with one of them -- a damaged, brainy troublemaker (newcomer Dominic Sessa) -- and with the school's head cook, who has just lost a son in Vietnam (Da'Vine Joy Randolph).",Alexander Payne
comedy,Kung Fu Panda 4,87,72,"After three death-defying adventures defeating world-class villains with his unmatched courage and mad martial arts skills, Po, the Dragon Warrior (Golden Globe nominee Jack Black), is called upon by destiny to... give it a rest already. More specifically, he's tapped to become the Spiritual Leader of the Valley of Peace. That poses a couple of obvious problems. First, Po knows as much about spiritual leadership as he does about the paleo diet, and second, he needs to quickly find and train a new Dragon Warrior before he can assume his new lofty position. Even worse, there's been a recent sighting of a wicked, powerful sorceress, Chameleon (Oscar® winner Viola Davis), a tiny lizard who can shapeshift into any creature, large or small. And Chameleon has her greedy, beady little eyes on Po's Staff of Wisdom, which would give her the power to re-summon all the master villains whom Po has vanquished to the spirit realm. So, Po’s going to need some help. He finds it (kinda?) in the form of crafty, quick-witted thief Zhen (Golden Globe winner Awkwafina), a corsac fox who really gets under Po’s fur but whose skills will prove invaluable. In their quest to protect the Valley of Peace from Chameleon’s reptilian claws, this comedic odd-couple duo will have to work together. In the process, Po will discover that heroes can be found in the most unexpected places.",Mike Mitchell
comedy,Poor Things,79,92,"From filmmaker Yorgos Lanthimos and producer Emma Stone comes the incredible tale and fantastical evolution of Bella Baxter (Stone), a young woman brought back to life by the brilliant and unorthodox scientist Dr. Godwin Baxter (Willem Dafoe). Under Baxter's protection, Bella is eager to learn. Hungry for the worldliness she is lacking, Bella runs off with Duncan Wedderburn (Mark Ruffalo), a slick and debauched lawyer, on a whirlwind adventure across the continents. Free from the prejudices of her times, Bella grows steadfast in her purpose to stand for equality and liberation.",Yorgos Lanthimos
comedy,Bullet Train,76,54,"In Bullet Train, Brad Pitt stars as Ladybug, an unlucky assassin determined to do his job peacefully after one too many gigs gone off the rails. Fate, however, may have other plans, as Ladybug's latest mission puts him on a collision course with lethal adversaries from around the globe -- all with connected, yet conflicting, objectives -- on the world's fastest train. From the director of Deadpool 2, David Leitch, the end of the line is only the beginning in a wild, non-stop thrill ride through modern-day Japan.",David Leitch
comedy,The Peanut Butter Falcon,96,95,"After running away from a residential nursing home to pursue his dream of becoming a pro wrestler, a man who has Down syndrome befriends an outlaw who becomes his coach and ally.","Tyler Nilson, Michael Schwartz"
comedy,The Gentlemen,84,75,"Mickey Pearson is an American expatriate who became rich by building a highly profitable marijuana empire in London. When word gets out that he's looking to cash out of the business, it soon triggers an array of plots and schemes -- including bribery and blackmail -- from shady characters who want to steal his domain.",Guy Ritchie
comedy,Dream Scenario,68,91,"Hapless family man Paul Matthews (Nicolas Cage) finds his life turned upside down when millions of strangers suddenly start seeing him in their dreams. But when his nighttime appearances take a nightmarish turn, Paul is forced to navigate his newfound stardom, in this wickedly entertaining comedy from writer-director Kristoffer Borgli (Sick of Myself) and producer Ari Aster.",Kristoffer Borgli
comedy,Wish,81,48,"Walt Disney Animation Studios' ""Wish"" is an all-new musical-comedy welcoming audiences to the magical kingdom of Rosas, where Asha, a sharp-witted idealist, makes a wish so powerful that it is answered by a cosmic force--a little ball of boundless energy called Star. Together, Asha and Star confront a most formidable foe--the ruler of Rosas, King Magnifico--to save her community and prove that when the will of one courageous human connects with the magic of the stars, wondrous things can happen.","Chris Buck, Fawn Veerasunthorn"
comedy,The American Society of Magical Negroes,63,26,"THE AMERICAN SOCIETY OF MAGICAL NEGROES is a fresh, satirical comedy inspired by the ""magical negro"" cinematic trope popularized in American cinema and television throughout the 20th Century and first named and criticized by filmmaker Spike Lee. Flipping the trope on its head, THE AMERICAN SOCIETY OF MAGICAL NEGROES follows a young man, Aren, who is recruited into a secret society of magical Black people who dedicate their lives to a cause of utmost importance: making white people more comfortable. Although initially enamored with his new powers, Aren begins to question the value of using supernatural means to do the very thing he's felt obligated to do his whole life.",Kobi Libii
crime,The Last Stop in Yuma County,,98,"While awaiting the next fuel truck at a middle-of-nowhere Arizona rest stop, a traveling young knife salesman is thrust into a high-stakes hostage situation by the arrival of two similarly stranded bank robbers with no qualms about using cruelty--or cold, hard steel--to protect their bloodstained, ill-begotten fortune.",Francis Galluppi
crime,"LaRoy, Texas",62,100,"Broke and depressed, Ray (John Magaro) is mistaken for a dangerous hitman and given an envelope of cash. Along with his P.I. friend Skip (Steve Zahn), he must escape the actual hitman to make it out of LaRoy alive.",Shane Atkinson
crime,Love Lies Bleeding,82,94,"From Director Rose Glass comes an electric new love story; reclusive gym manager Lou falls hard for Jackie, an ambitious bodybuilder headed through town to Vegas in pursuit of her dream. But their love ignites violence, pulling them deep into the web of Lou's criminal family.",Rose Glass
crime,The Gentlemen,84,75,"Mickey Pearson is an American expatriate who became rich by building a highly profitable marijuana empire in London. When word gets out that he's looking to cash out of the business, it soon triggers an array of plots and schemes -- including bribery and blackmail -- from shady characters who want to steal his domain.",Guy Ritchie
crime,Anatomy of a Fall,90,96,"For the past year, Sandra, her husband Samuel, and their eleven-year-old son Daniel have lived a secluded life in a remote town in the French Alps. When Samuel is found dead in the snow below their chalet, the police question whether he was murdered or committed suicide. Samuel's suspicious death is presumed murder, and Sandra becomes the main suspect. What follows is not just an investigation into the circumstances of Samuel's death but an unsettling psychological journey into the depths of Sandra and Samuel's conflicted relationship.",Justine Triet
crime,Sleeping Dogs,87,38,"In this gripping crime thriller, Russell Crowe stars as Roy Freeman, an ex-homicide detective with a fractured memory, forced to revisit a case he can't remember. As a man's life hangs in the balance on death row, Freeman must piece together the brutal evidence from a decade-old murder investigation, uncovering a sinister web of buried secrets and betrayals linking to his past. With only instincts to trust, he faces a chilling truth -- sometimes, it's best to let sleeping dogs lie.",Adam Cooper
crime,Killers of the Flower Moon,84,93,"Based on David Grann's broadly lauded best-selling book, ""Killers of the Flower Moon"" is set in 1920s Oklahoma and depicts the serial murder of members of the oil-wealthy Osage Nation, a string of brutal crimes that came to be known as the Reign of Terror.",Martin Scorsese
crime,The Little Things,67,45,"Deputy Sheriff Joe ""Deke"" Deacon joins forces with Sgt. Jim Baxter to search for a serial killer who's terrorizing Los Angeles. As they track the culprit, Baxter is unaware that the investigation is dredging up echoes of Deke's past, uncovering disturbing secrets that could threaten more than his case.",John Lee Hancock
