Genre,Title,Audience Score,Critics Score,Synopsis,Director
kids_and_family,Puss in Boots: The Last Wish,94,95,"This fall, everyone's favorite leche-loving, swashbuckling, fear-defying feline returns. For the first time in more than a decade, DreamWorks Animation presents a new adventure in the Shrek universe as daring outlaw Puss in Boots discovers that his passion for peril and disregard for safety have taken their toll. Puss has burned through eight of his nine lives, though he lost count along the way. Getting those lives back will send Puss in Boots on his grandest quest yet. Academy Award® nominee Antonio Banderas returns as the voice of the notorious PiB as he embarks on an epic journey into the Black Forest to find the mythical Wishing Star and restore his lost lives. But with only one life left, Puss will have to humble himself and ask for help from his former partner and nemesis: the captivating Kitty Soft Paws (Oscar® nominee Salma Hayek). In their quest, Puss and Kitty will be aided--against their better judgment--by a ratty, chatty, relentlessly cheerful mutt, Perro (Harvey Guillén, What We Do in the Shadows). Together, our trio of heroes will have to stay one step ahead of Goldilocks (Oscar® nominee Florence Pugh, Black Widow) and the Three Bears Crime Family, ""Big"" Jack Horner (Emmy winner John Mulaney, Big Mouth) and terrifying bounty hunter, The Big Bad Wolf (Wagner Moura, Narcos).",Joel Crawford
kids_and_family,Teenage Mutant Ninja Turtles: Mutant Mayhem,90,95,"After years of being sheltered from the human world, the Turtle brothers set out to win the hearts of New Yorkers and be accepted as normal teenagers. Their new friend, April O'Neil, helps them take on a mysterious crime syndicate, but they soon get in over their heads when an army of mutants is unleashed upon them.",Jeff Rowe
kids_and_family,Sonic the Hedgehog 2,96,69,"The world's favorite blue hedgehog is back for a next-level adventure in SONIC THE HEDGEHOG 2. After settling in Green Hills, Sonic is eager to prove he has what it takes to be a true hero. His test comes when Dr. Robotnik returns, this time with a new partner, Knuckles, in search for an emerald that has the power to destroy civilizations. Sonic teams up with his own sidekick, Tails, and together they embark on a globe-trotting journey to find the emerald before it falls into the wrong hands.",Jeff Fowler
kids_and_family,Inside Out,89,98,"Riley (Kaitlyn Dias) is a happy, hockey-loving 11-year-old Midwestern girl, but her world turns upside-down when she and her parents move to San Francisco. Riley's emotions -- led by Joy (Amy Poehler) -- try to guide her through this difficult, life-changing event. However, the stress of the move brings Sadness (Phyllis Smith) to the forefront. When Joy and Sadness are inadvertently swept into the far reaches of Riley's mind, the only emotions left in Headquarters are Anger, Fear and Disgust.",Pete Docter
kids_and_family,Spider-Man: Into the Spider-Verse,94,97,"Bitten by a radioactive spider in the subway, Brooklyn teenager Miles Morales suddenly develops mysterious powers that transform him into the one and only Spider-Man. When he meets Peter Parker, he soon realizes that there are many others who share his special, high-flying talents. Miles must now use his newfound skills to battle the evil Kingpin, a hulking madman who can open portals to other universes and pull different versions of Spider-Man into our world.","Bob Persichetti, Peter Ramsey, Rodney Rothman"
kids_and_family,Orion and the Dark,62,91,"The thing Orion fears the most is the dark. When the embodiment of his worst fear pays a visit, Dark whisks Orion away on a roller-coaster ride around the world to prove there is nothing to be afraid of at night.",Sean Charmatz
kids_and_family,Shrek 2,69,89,"After returning from their honeymoon and showing home movies to their friends, Shrek and Fiona learn that her parents have heard that she has married her true love and wish to invite him to their kingdom, called Far Far Away. The catch is: Fiona's parents are unaware of the curse that struck their daughter and have assumed she married Prince Charming, not a 700-pound ogre with horrible hygiene and a talking donkey pal.","Andrew Adamson, Kelly Asbury, Conrad Vernon"
kids_and_family,How to Train Your Dragon,91,99,"Hiccup (Jay Baruchel) is a Norse teenager from the island of Berk, where fighting dragons is a way of life. His progressive views and weird sense of humor make him a misfit, despite the fact that his father (Gerard Butler) is chief of the clan. Tossed into dragon-fighting school, he endeavors to prove himself as a true Viking, but when he befriends an injured dragon he names Toothless, he has the chance to plot a new course for his people's future.","Christopher Sanders, Dean DeBlois"
kids_and_family,Paddington 2,88,99,"Settled in with the Brown family, Paddington the bear is a popular member of the community who spreads joy and marmalade wherever he goes. One fine day, he spots a pop-up book in an antique shop -- the perfect present for his beloved aunt's 100th birthday. When a thief steals the prized book, Paddington embarks on an epic quest to unmask the culprit before Aunt Lucy's big celebration.",Paul King
kids_and_family,Elemental,93,73,"Disney and Pixar's ""Elemental,"" an all-new, original feature film set in Element City, where fire-, water-, land- and air-residents live together. The story introduces Ember, a tough, quick-witted and fiery young woman, whose friendship with a fun, sappy, go-with-the-flow guy named Wade challenges her beliefs about the world they live in.",Peter Sohn
kids_and_family,Coco,94,97,"Despite his family's generations-old ban on music, young Miguel dreams of becoming an accomplished musician like his idol Ernesto de la Cruz. Desperate to prove his talent, Miguel finds himself in the stunning and colorful Land of the Dead. After meeting a charming trickster named Héctor, the two new friends embark on an extraordinary journey to unlock the real story behind Miguel's family history.",Lee Unkrich
kids_and_family,Turning Red,67,95,"In ""Turning Red"", Mei Lee is a confident, dorky thirteen-year-old torn between staying her mother's dutiful daughter and the chaos of adolescence. And as if changes to her interests, relationships, and body weren't enough, whenever she gets too excited (which for a teenager is practically ALWAYS), she ""poofs"" into a giant red panda!",Domee Shi
kids_and_family,The Little Mermaid,94,67,"The youngest of King Triton's daughters, and the most defiant, Ariel longs to find out more about the world beyond the sea, and while visiting the surface, falls for the dashing Prince Eric. While mermaids are forbidden to interact with humans, Ariel must follow her heart. She makes a deal with the evil sea witch, Ursula, which gives her a chance to experience life on land, but ultimately places her life -- and her father's crown -- in jeopardy.",Rob Marshall
kids_and_family,Zootopia,92,98,"From the largest elephant to the smallest shrew, the city of Zootopia is a mammal metropolis where various animals live and thrive. When Judy Hopps (Ginnifer Goodwin) becomes the first rabbit to join the police force, she quickly learns how tough it is to enforce the law. Determined to prove herself, Judy jumps at the opportunity to solve a mysterious case. Unfortunately, that means working with Nick Wilde (Jason Bateman), a wily fox who makes her job even harder.","Byron Howard, Rich Moore"
kids_and_family,Up,90,98,"Carl Fredricksen (Ed Asner), a 78-year-old balloon salesman, is about to fulfill a lifelong dream. Tying thousands of balloons to his house, he flies away to the South American wilderness. But curmudgeonly Carl's worst nightmare comes true when he discovers a little boy named Russell is a stowaway aboard the balloon-powered house.","Pete Docter, Bob Peterson"
kids_and_family,Toy Story,92,100,"Woody (Tom Hanks), a good-hearted cowboy doll who belongs to a young boy named Andy (John Morris), sees his position as Andy's favorite toy jeopardized when his parents buy him a Buzz Lightyear (Tim Allen) action figure. Even worse, the arrogant Buzz thinks he's a real spaceman on a mission to return to his home planet. When Andy's family moves to a new house, Woody and Buzz must escape the clutches of maladjusted neighbor Sid Phillips (Erik von Detten) and reunite with their boy.",John Lasseter
kids_and_family,Toy Story 2,87,100,"Woody (Tom Hanks) is stolen from his home by toy dealer Al McWhiggin (Wayne Knight), leaving Buzz Lightyear (Tim Allen) and the rest of the gang to try to rescue him. But when Woody discovers that he's actually a valuable collectible from a once-popular television show called ""Woody's Roundup"" and is reunited with his horse Bullseye, Jessie the yodeling cowgirl (Joan Cusack) and his faithful sidekick, Stinky Pete the Prospector (Kelsey Grammer), he doesn't want to leave.","Ash Brannon, John Lasseter, Lee Unkrich"
sports,The Iron Claw,94,89,"The true story of the inseparable Von Erich brothers, who made history in the intensely competitive world of professional wrestling in the early 1980s. Through tragedy and triumph, under the shadow of their domineering father and coach, the brothers seek larger-than-life immortality on the biggest stage in sports.",Sean Durkin
sports,The Boys in the Boat,97,58,"The Boys in the Boat is a sports drama based on the #1 New York Times bestselling non-fiction novel written by Daniel James Brown. The film, directed by George Clooney, is about the 1936 University of Washington rowing team that competed for gold at the Summer Olympics in Berlin. This inspirational true story follows a group of underdogs at the height of the Great Depression as they are thrust into the spotlight and take on elite rivals from around the world.",George Clooney
sports,The Beautiful Game,68,85,"Mal (Bill Nighy, Living, About Time) is the manager of England's homeless football team, taking his players to Rome with the hope of being crowned champions of the Homeless World Cup, a global street soccer tournament. At the last minute he decides to bring with them a talented striker Vinny (Micheal Ward, Empire of Light, The Book of Clarence), who could give them a real chance at winning, but only if he's ready to let go of his past and become part of the team. Made with the support of the Homeless World Cup,The Beautiful Game is a film of second chances -- where homeless teams from around the world find that all roads lead to Rome, and everything's to play for.",Thea Sharrock
sports,Next Goal Wins,84,45,"Directed by Academy Award Winner Taika Waititi (Jojo Rabbit, Thor: Ragnarok), NEXT GOAL WINS follows the American Samoa soccer team, infamous for their brutal 31-0 FIFA loss in 2001. With the World Cup Qualifiers approaching, the team hires down-on-his-luck, maverick coach Thomas Rongen (Michael Fassbender) hoping he will turn the world's worst soccer team around in this heartfelt underdog comedy.",Taika Waititi
sports,Air,98,93,"From award-winning director Ben Affleck, AIR reveals the unbelievable game-changing partnership between a then-rookie Michael Jordan and Nike's fledgling basketball division which revolutionized the world of sports and contemporary culture with the Air Jordan brand. This moving story follows the career-defining gamble of an unconventional team with everything on the line, the uncompromising vision of a mother who knows the worth of her son’s immense talent, and the basketball phenom who would become the greatest of all time.",Ben Affleck
sports,Big George Foreman: The Miraculous Story of the Once and Future Heavyweight Champion of the World,96,42,"Big George Foreman: The Miraculous Story of the Once and Future Heavyweight Champion of the World is based on the remarkable true story of one of the greatest comebacks of all time and the transformational power of second chances. Fueled by an impoverished childhood, Foreman channeled his anger into becoming an Olympic Gold medalist and World Heavyweight Champion, followed by a near-death experience that took him from the boxing ring to the pulpit. But when he sees his community struggling spiritually and financially, Foreman returns to the ring and makes history by reclaiming his title, becoming the oldest and most improbable World Heavyweight Boxing Champion ever.",George Tillman Jr.
sports,The Deepest Breath,93,85,"A champion freediver trains to break a world record with the help of an expert safety diver, and the two form an emotional bond that feels like fate. This heart-stopping film follows the paths they took to meet at the pinnacle of the freediving world, documenting the thrilling rewards -- and inescapable risks -- of chasing a dream through the silent depths of the ocean.",Laura McGann
sports,The Swimmers,86,83,"Based on a true story, THE SWIMMERS follows the journey from war-torn Syria to the 2016 Rio Olympics. Two young sisters embark on a harrowing journey as refugees, putting both their hearts and champion swimming skills to heroic use.",Sally El Hosaini
sports,Lady Ballers,89,43,"A once-great coach is on a journey back to victory by reuniting his former high school championship basketball team, but this time, he’s challenging them to play like girls.",Jeremy Boreing
sports,The Underdoggs,58,41,"Jaycen ""Two Js"" Jennings (Snoop Dogg) is a washed-up ex-professional football star who has hit rock bottom. When Jaycen is sentenced to community service coaching the Underdoggs, an unruly pee-wee football team in his hometown of Long Beach, California, he sees it as an opportunity to rebuild his public image and turn his life around. As Jaycen works to transform the foul-mouthed Underdoggs into top-notch champions, he reconnects with his past, including an old flame and few of his ex-teammates and rediscovers his love of the game.",Charles Stone III
sports,White Men Can't Jump,60,26,"From 20th Century Studios, the all-new comedy ""White Men Can't Jump"" is a modern remix of the iconic 1992 film that celebrates the streetball hustling culture of Los Angeles. Multi-platinum rap superstar Jack Harlow makes his movie debut as Jeremy, a former star of the game whose injuries stalled his career, and Sinqua Walls stars as Kamal, once a promising player who derailed his own future in the sport. Juggling tenuous relationships, financial pressures and serious internal struggles, the two ballers--opposites who are seemingly miles apart--find they might have more in common than they imagined possible.",Calmatic
sports,I Can,91,,"Based on a true story, a couple's adulterous affair leads to an unexpected pregnancy. They leave their spouses to begin a new life together, but their daughter, Katelyn, is born with a birth defect. While her dad believes Katelyn's condition is God’s punishment for the affair, Katelyn, with only one fully developed arm, defies all odds with an incredible gift for softball. ""I Can"" is a story about Katelyn overcoming adversity, and her dad eventually finding genuine forgiveness.",Tyler Sansom
sports,Perfect Addiction,66,,"MMA trainer Sienna thinks that she and champion boyfriend Jax are the perfect team. That is, until the day she discovers him cheating on her with her own sister. Bent on revenge, Sienna starts training the one man capable of dethroning Jax: his arch-nemesis Kayden. What begins as payback quickly turns into something much more heated as boundaries are blurred and workouts get steamy. Based on the wildly popular novel by Claudia Tan.",Castille Landon
sports,The Lionheart,95,,"In 2011, two-time Indianapolis 500 champion Dan Wheldon, nicknamed ""The Lionheart,"" died in a horrific crash at the Las Vegas Motor Speedway, shaking the world of motorsports to its core. Ten years later, Dan's two sons, Sebastian and Oliver, follow in their father's footsteps as they work through their loss the only way they know how -- getting behind the wheel to race. THE LIONHEART blends archival footage with vérité storytelling to weave together two distinct narratives: Dan's storied career in the past and the present day lives of Dan's widow Susie and sons Sebastian and Oliver. As Susie grapples with her grief and the responsibility of raising their sons alone, the two boys, ages 12 and 10, take on their father's mantle and enter the world of professional racing. As an epic sports story unfolds within the ongoing intergenerational family drama, the film explores Susie's dilemma as a mother who questions whether her family's lineage is a blessing or a burden while watching her sons, with the high-risk sport deeply embedded in their DNA, try to reconcile their father's absence by embracing the very sport that took him from them.",Laura Brownson
sports,Shooting Stars,70,54,"Shooting Stars is set in the 1990s, where a young LeBron James (Marquis ""Mookie"" Cook) and his three best friends -- Lil Dru (Caleb McLaughlin, Stranger Things), Willie McGee (Avery S. Wills, Jr., Swagger) and Sian Cotton (Khalil Everage, Cobra Kai)--declare themselves the ""Fab Four,"" after the famed Michigan Wolverines' ""Fab Five"" of that era. From the moment we meet them, we realize this group of friends, under the guidance of coach Dru Joyce (Wood Harris; Creed franchise), is connected by more than basketball. So, when the coach at the top basketball school in their district threatens to separate them by putting Lil Dru on junior varsity, the Fab Four decide to switch schools to be able to play varsity together, joining the team at a predominantly white Catholic school instead. The community takes this as an insult, but the boys' dedication to each other is more important than anything else. With their new coach (Dermot Mulroney; August: Osage County), a disgraced former college coach seeking redemption of his own, the boys, along with former rival and new teammate Romeo Travis (newcomer Sterling ""Scoot"" Henderson), will face battles not only on the court but in real life, in their quest to become national champs, and will rediscover that what matters most about the game is the people playing beside you.",Chris Robinson
sports,Sweetwater,95,25,"Hall of Famer Nat ""Sweetwater"" Clifton makes history as the first African American to sign an NBA contract, forever changing how the game of basketball is played.",Martin Guigui
sports,Torn,89,100,"Widely hailed as the greatest mountaineer of his generation, Alex Lowe was a towering figure in the world of outdoor sports. But he loomed even larger for his oldest son, Max, who was only 11 in 1999 when Alex was buried by an avalanche along with cameraman David Bridges while attempting to ski the north face of Mount Shishapangma in the Tibetan Himalaya. Seventeen years after their deaths, Lowe's and Bridges' bodies were found by two climbers attempting the same route, and in the following months, Lowe's family journeyed to the remote mountain to recover them. In the powerful and deeply moving new documentary TORN, director Max Lowe examines the long-buried feelings this unearthed for him and his family, including his mother, Jennifer; his younger brothers, Sam and Isaac; and his stepfather, Conrad Anker, Alex's climbing partner and best friend.",Max Lowe
sports,Punch,71,81,"Jim is a seventeen-year-old boxer in a small town. He is a golden boy, preparing for a fight that will elevate him to an early professional status. All bets are on his climb to success. But his father Stan is a demanding coach and a notorious alcoholic. In the town Stan is treated like a joke but he has given everything to see his son gain professional status and escape the brutality of his small world. As Jim begins to rethink why he is fighting his life tangles with Whetu, a razor-tongued, gay Maori boy who spends his days in an old shack down by the beach. With his dog Moimoi he cobbles together a fragile glamour and dreams of leaving town to become a musician. As Jim stumbles towards discovering what it really is to be a gay man, he is forced to see that strength has little to do with heroism.",Welby Ings
sports,Bye Bye Barry,98,91,"When NFL superstar Barry Sanders vanished at the height of his career, he left the NFL world in shock. He was still in his prime, chasing the all-time NFL rushing record when he boarded a flight to England and never stepped foot on the field again. Now, 24 years later, Barry retraces his steps through the streets of London to finally confront the mystery.","Paul Monusky, Micaela Powers, Angela Torma"
reality,Meet Me in Paris,88,,"Love like in the movies. Three real women follow the script and write their own endings in Meet Me in Paris, a first-of-its-kind reality rom-com and Roku Original Film from Hello Sunshine and Cinestar.",N/A
music,One Hand Don't Clap,,,"ONE HAND DON'T CLAP captures the vibrant story of calypso and the emergence of soca, through the eyes of two legendary artists, Lord Kitchener, the Grandmaster of the music and Calypso Rose, the first woman to break through in a traditionally male arena. Forging onscreen the connections between American communities and where families come from, the documentary leads audiences from New York recording studies to the awesome magic of Carnival in Trinidad & Tobago. The film features artists across the 20th century whose songs reflect regional and global themes that continue to resonate. The many generations in ONE HAND DON'T CLAP trace the evolution of a musical style whose infectious rhythms and exhilarating irreverence have found their way to ever-broadening audiences worldwide.",Kavery Dutta
music,Roots of Fire,,,"The battle to revive dying tradition comes to life through the young musicians of Southwest Louisiana in this powerful musical documentary. Amidst shuttered rural dance clubs and encroaching globalization, five Grammy award-winning artists lend their voices, examine the discrimination that almost erased their customs, and share the unique sounds created when the forces of fresh talent and deep history collide to fight for cultural survival.","Abby Berendt Lavoi, Jeremey Lavoi"
music,Bob Marley: One Love,92,44,"BOB MARLEY: ONE LOVE celebrates the life and music of an icon who inspired generations through his message of love and unity. On the big screen for the first time, discover Bob's powerful story of overcoming adversity and the journey behind his revolutionary music.",Reinaldo Marcus Green
music,Priscilla,63,84,"When teenage Priscilla Beaulieu meets Elvis Presley at a party, the man who is already a meteoric rock-and-roll superstar becomes someone entirely unexpected in private moments: a thrilling crush, an ally in loneliness, a vulnerable best friend. Through Priscilla’s eyes, Sofia Coppola tells the unseen side of a great American myth in Elvis and Priscilla's long courtship and turbulent marriage, from a German army base to his dream-world estate at Graceland, in this deeply felt and ravishingly detailed portrait of love, fantasy, and fame.",Sofia Coppola
music,Coco,94,97,"Despite his family's generations-old ban on music, young Miguel dreams of becoming an accomplished musician like his idol Ernesto de la Cruz. Desperate to prove his talent, Miguel finds himself in the stunning and colorful Land of the Dead. After meeting a charming trickster named Héctor, the two new friends embark on an extraordinary journey to unlock the real story behind Miguel's family history.",Lee Unkrich
music,I Can Only Imagine,91,67,"Growing up in Greenville, Texas, Bart Millard suffers physical and emotional abuse at the hands of his father, Arthur. When Arthur becomes terminally ill, he finds redemption by embracing his faith and rediscovering his love for his son. Years later, Bart's troubled childhood and mended relationship with his dad inspires him to write the hit song ""I Can Only Imagine"" as singer of the Christian band MercyMe.","Andrew Erwin, Jon Erwin"
music,Elvis,94,77,"The film explores the life and music of Elvis Presley (Austin Butler), seen through the prism of his complicated relationship with his enigmatic manager, Colonel Tom Parker (Tom Hanks). The story delves into the complex dynamic between Presley and Parker spanning over 20 years, from Presley's rise to fame to his unprecedented stardom, against the backdrop of the evolving cultural landscape and loss of innocence in America. Central to that journey is one of the most significant and influential people in Elvis's life, Priscilla Presley (Olivia DeJonge).",Baz Luhrmann
music,Stop Making Sense,97,100,Filmmaker Jonathan Demme captures Talking Heads and an ecstatic ensemble of musicians at their exhilarating best in this iconic live performance.,Jonathan Demme
music,Maestro,57,79,"Maestro is a towering and fearless love story chronicling the lifelong relationship between Leonard Bernstein and Felicia Montealegre Cohn Bernstein. A love letter to life and art, Maestro at its core is an emotionally epic portrayal of family and love.",Bradley Cooper
music,Yesterday,89,63,"Jack Malik is a struggling singer-songwriter in an English seaside town whose dreams of fame are rapidly fading, despite the fierce devotion and support of his childhood best friend, Ellie. After a freak bus accident during a mysterious global blackout, Jack wakes up to discover that The Beatles have never existed. Performing songs by the greatest band in history to a world that has never heard them, Jack becomes on overnight sensation with a little help from his agent.",Danny Boyle
music,Amy,87,96,Archival footage and personal testimonials present an intimate portrait of the life and career of British singer/songwriter Amy Winehouse.,Asif Kapadia
