Genre,Title,Audience Score,Critics Score,Synopsis,Director
fantasy,All of Us Strangers,91,97,"One night in his near-empty tower block in contemporary London, Adam (Andrew Scott) has a chance encounter with a mysterious neighbor Harry (Paul Mescal), which punctures the rhythm of his everyday life. As a relationship develops between them, Adam is preoccupied with memories of the past and finds himself drawn back to the suburban town where he grew up, and the childhood home where his parents (Claire Foy and Jamie Bell), appear to be living, just as they were on the day they died, 30 years before.",Andrew Haigh
fantasy,Rebel Moon: Part One - A Child of Fire,57,21,"From Zack Snyder, the filmmaker behind 300, Man of Steel, and Army of the Dead, comes REBEL MOON, an epic science-fantasy event decades in the making. When a peaceful colony on the edge of a galaxy finds itself threatened by the armies of a tyrannical ruling force, Kora (Sofia Boutella), a mysterious stranger living among the villagers, becomes their best hope for survival. Tasked with finding trained fighters who will unite with her in making an impossible stand against the Mother World, Kora assembles a small band of warriors -- outsiders, insurgents, peasants and orphans of war from different worlds who share a common need for redemption and revenge. As the shadow of an entire Realm bears down on the unlikeliest of moons, a battle over the fate of a galaxy is waged, and in the process, a new army of heroes is formed.",Zack Snyder
fantasy,Wish,81,48,"Walt Disney Animation Studios' ""Wish"" is an all-new musical-comedy welcoming audiences to the magical kingdom of Rosas, where Asha, a sharp-witted idealist, makes a wish so powerful that it is answered by a cosmic force--a little ball of boundless energy called Star. Together, Asha and Star confront a most formidable foe--the ruler of Rosas, King Magnifico--to save her community and prove that when the will of one courageous human connects with the magic of the stars, wondrous things can happen.","Chris Buck, Fawn Veerasunthorn"
fantasy,The American Society of Magical Negroes,63,26,"THE AMERICAN SOCIETY OF MAGICAL NEGROES is a fresh, satirical comedy inspired by the ""magical negro"" cinematic trope popularized in American cinema and television throughout the 20th Century and first named and criticized by filmmaker Spike Lee. Flipping the trope on its head, THE AMERICAN SOCIETY OF MAGICAL NEGROES follows a young man, Aren, who is recruited into a secret society of magical Black people who dedicate their lives to a cause of utmost importance: making white people more comfortable. Although initially enamored with his new powers, Aren begins to question the value of using supernatural means to do the very thing he's felt obligated to do his whole life.",Kobi Libii
fantasy,Wonka,91,82,"Based on the extraordinary character at the center of Charlie and the Chocolate Factory, Roald Dahl’s most iconic children's book and one of the best-selling children's books of all time, ""Wonka"" tells the wondrous story of how the world's greatest inventor, magician and chocolate-maker became the beloved Willy Wonka we know today.",Paul King
fantasy,Dune,90,83,"Paul Atreides, a brilliant and gifted young man born into a great destiny beyond his understanding, must travel to the most dangerous planet in the universe to ensure the future of his family and his people. As malevolent forces explode into conflict over the planet's exclusive supply of the most precious resource in existence, only those who can conquer their own fear will survive.",Denis Villeneuve
fantasy,The Mummy,75,62,"The Mummy is a rousing, suspenseful and horrifying epic about an expedition of treasure-seeking explorers in the Sahara Desert in 1925. Stumbling upon an ancient tomb, the hunters unwittingly set loose a 3,000-year-old legacy of terror, which is embodied in the vengeful reincarnation of an Egyptian priest who had been sentenced to an eternity as one of the living dead.",Stephen Sommers
fantasy,Damsel,60,57,"A dutiful damsel agrees to marry a handsome prince, only to find the royal family has recruited her as a sacrifice to repay an ancient debt. Thrown into a cave with a fire-breathing dragon, she must rely on her wits and will to survive.",Juan Carlos Fresnadillo
fantasy,The Marvels,82,62,"Carol Danvers aka Captain Marvel has reclaimed her identity from the tyrannical Kree and taken revenge on the Supreme Intelligence. But unintended consequences see Carol shouldering the burden of a destabilized universe. When her duties send her to an anomalous wormhole linked to a Kree revolutionary, her powers become entangled with that of Jersey City super-fan, Kamala Khan aka Ms. Marvel, and Carol's estranged niece, now S.A.B.E.R. astronaut Captain Monica Rambeau. Together, this unlikely trio must team-up and learn to work in concert to save the universe as ""The Marvels.""",Nia DaCosta
fantasy,Everything Everywhere All at Once,86,93,"Directed by Daniel Kwan and Daniel Scheinert, collectively known as Daniels, the film is a hilarious and big-hearted sci-fi action adventure about an exhausted Chinese American woman (Michelle Yeoh) who can't seem to finish her taxes.","Dan Kwan, Daniel Scheinert"
fantasy,Ricky Stanicky,72,47,"When three childhood best friends pull a prank gone wrong, they invent the imaginary Ricky Stanicky to get them out of trouble! Twenty years after creating this 'friend,' Dean, JT, and Wes (Zac Efron, Andrew Santino, and Jermaine Fowler) still use the nonexistent Ricky as a handy alibi for their immature behavior. When their spouses and partners get suspicious and demand to finally meet the fabled Mr. Stanicky, the guilty trio decide to hire washed-up actor and raunchy celebrity impersonator ""Rock Hard"" Rod (John Cena) to bring him to life. But when Rod takes his role of a lifetime too far, they begin to wish they'd never invented Ricky in the first place.",Peter Farrelly
fantasy,Star Wars: The Rise of Skywalker,86,51,"When it's discovered that the evil Emperor Palpatine did not die at the hands of Darth Vader, the rebels must race against the clock to find out his whereabouts. Finn and Poe lead the Resistance to put a stop to the First Order's plans to form a new Empire, while Rey anticipates her inevitable confrontation with Kylo Ren. Warning: Some flashing-lights scenes in this film may affect photosensitive viewers.",J.J. Abrams
fantasy,Star Wars: The Last Jedi,42,91,"Luke Skywalker's peaceful and solitary existence gets upended when he encounters Rey, a young woman who shows strong signs of the Force. Her desire to learn the ways of the Jedi forces Luke to make a decision that changes their lives forever. Meanwhile, Kylo Ren and General Hux lead the First Order in an all-out assault against Leia and the Resistance for supremacy of the galaxy.",Rian Johnson
fantasy,Star Wars: Episode III - Revenge of the Sith,66,79,"It has been three years since the Clone Wars began. Jedi Master Obi-Wan Kenobi (Ewan McGregor) and Jedi Knight Anakin Skywalker (Hayden Christensen) rescue Chancellor Palpatine (Ian McDiarmid) from General Grievous, the commander of the droid armies, but Grievous escapes. Suspicions are raised within the Jedi Council concerning Chancellor Palpatine, with whom Anakin has formed a bond. Asked to spy on the chancellor, and full of bitterness toward the Jedi Council, Anakin embraces the Dark Side.",George Lucas
fantasy,Aquaman and the Lost Kingdom,81,34,"After failing to defeat Aquaman the first time, Black Manta wields the power of the mythic Black Trident to unleash an ancient and malevolent force. Hoping to end his reign of terror, Aquaman forges an unlikely alliance with his brother, Orm, the former king of Atlantis. Setting aside their differences, they join forces to protect their kingdom and save the world from irreversible destruction.",James Wan
fantasy,Marvel's the Avengers,91,91,"When Thor's evil brother, Loki (Tom Hiddleston), gains access to the unlimited power of the energy cube called the Tesseract, Nick Fury (Samuel L. Jackson), director of S.H.I.E.L.D., initiates a superhero recruitment effort to defeat the unprecedented threat to Earth. Joining Fury's ""dream team"" are Iron Man (Robert Downey Jr.), Captain America (Chris Evans), the Hulk (Mark Ruffalo), Thor (Chris Hemsworth), the Black Widow (Scarlett Johansson) and Hawkeye (Jeremy Renner).",Joss Whedon
fantasy,Avengers: Endgame,90,94,"Adrift in space with no food or water, Tony Stark sends a message to Pepper Potts as his oxygen supply starts to dwindle. Meanwhile, the remaining Avengers -- Thor, Black Widow, Captain America and Bruce Banner -- must figure out a way to bring back their vanquished allies for an epic showdown with Thanos -- the evil demigod who decimated the planet and the universe.","Anthony Russo, Joe Russo"
fantasy,Spider-Man: No Way Home,98,93,"For the first time in the cinematic history of Spider-Man, our friendly neighborhood hero's identity is revealed, bringing his Super Hero responsibilities into conflict with his normal life and putting those he cares about most at risk. When he enlists Doctor Strange's help to restore his secret, the spell tears a hole in their world, releasing the most powerful villains who've ever fought a Spider-Man in any universe. Now, Peter will have to overcome his greatest challenge yet, which will not only forever alter his own future but the future of the Multiverse.",Jon Watts
fantasy,Spirited Away,96,96,"10-year-old Chihiro (Daveigh Chase) moves with her parents to a new home in the Japanese countryside. After taking a wrong turn down a wooded path, Chihiro and her parents discover an amusement park with a stall containing an assortment of food. To her surprise, Chihiro's parents begin eating and then transform into pigs. In this supernatural realm, Chihiro encounters a host of characters and endures labor in a bathhouse for spirits, awaiting a reunion with her parents.",Hayao Miyazaki
fantasy,Spider-Man: Across the Spider-Verse,94,95,"Miles Morales returns for the next chapter of the Oscar®-winning Spider-Verse saga, an epic adventure that will transport Brooklyn's full-time, friendly neighborhood Spider-Man across the Multiverse to join forces with Gwen Stacy and a new team of Spider-People to face off with a villain more powerful than anything they have ever encountered.","Joaquim Dos Santos, Kemp Powers, Justin K. Thompson"
fantasy,Mortal Kombat,86,55,"In ""Mortal Kombat,"" MMA fighter Cole Young, accustomed to taking a beating for money, is unaware of his heritage--or why Outworld's Emperor Shang Tsung has sent his best warrior, Sub-Zero, an otherworldly Cryomancer, to hunt Cole down. Fearing for his family's safety, Cole goes in search of Sonya Blade at the direction of Jax, a Special Forces Major who bears the same strange dragon marking Cole was born with. Soon, he finds himself at the temple of Lord Raiden, an Elder God and the protector of Earthrealm, who grants sanctuary to those who bear the mark. Here, Cole trains with experienced warriors Liu Kang, Kung Lao and rogue mercenary Kano, as he prepares to stand with Earth's greatest champions against the enemies of Outworld in a high stakes battle for the universe. But will Cole be pushed hard enough to unlock his arcana--the immense power from within his soul--in time to save not only his family, but to stop Outworld once and for all?",Simon McQuoid
fantasy,Transformers: Rise of the Beasts,91,52,"Returning to the action and spectacle that have captured moviegoers around the world, Transformers: Rise of the Beasts will take audiences on a '90s globetrotting adventure with the Autobots and introduce a whole new faction of Transformer -- the Maximals -- to the existing battle on earth between Autobots and Decepticons.",Steven Caple Jr.
game_show,Make Me Scream,79,,"Hosted by horror fanatics and life-partners Tempestt Bledsoe (The Cosby Show) and Darryl M. Bell (A Different World), this hilariously horrifying Halloween special features three celebrity teams--led by Jaleel White (Family Matters), Shoniqua Shandai (Harlem), and rapper Lil Xan--that embark on a game where they must face a series of bone-chilling scare zones while trying NOT to scream, in order to survive the night and take home the prestigious Medal of Mayhem.",N/A
horror,Abigail,85,84,"After a group of would-be criminals kidnap the 12-year-old ballerina daughter of a powerful underworld figure, all they have to do to collect a $50 million ransom is watch the girl overnight. In an isolated mansion, the captors start to dwindle, one by one, and they discover, to their mounting horror, that they're locked inside with no normal little girl.","Matt Bettinelli-Olpin, Tyler Gillett"
horror,Founders Day,12,46,"In this satirical political slasher from the Bloomquist Brothers, a small town is shaken by a series of ominous killings in the days leading up to a heated mayoral election. As accusations fly and the threat of a masked killer darkens every street corner, the residents must race to uncover the truth before fear consumes the town.",Erik Bloomquist
horror,Mind Body Spirit,,89,"MIND BODY SPIRIT follows Anya, an aspiring yoga influencer, as she embarks on a ritual practice left behind by her estranged grandmother. What starts as a spiritual self-help guide quickly evolves into something much more sinister. As Anya becomes obsessed with the mysterious power of the practice, she unwittingly unleashes an otherworldly entity that begins to take control of her life -- and her videos. Now Anya must race to unlock the truth, before her descent into madness threatens to consume her mind, body and spirit.","Alex Henes, Matthew Merenda"
horror,Late Night with the Devil,81,97,"Johnny Carson rival Jack Delroy hosts a syndicated talk show 'Night Owls' that has long been a trusted companion to insomniacs around the country. However, ratings for the show have plummeted since the tragic death of Jack's beloved wife. Desperate to turn his fortunes around, on October 31st, 1977, Jack plans a Halloween special like no other--unaware he is about to unleash evil into the living rooms of America.","Colin Cairnes, Cameron Cairnes"
horror,Arcadian,55,83,"In a near future, life on Earth has been decimated. Paul (Nicolas Cage) and his twin teenage sons, Thomas (Jaeden Martell) and Joseph (Maxwell Jenkins), have been living a half-life -- tranquility by day and torment by night. When the sun sets, ferocious creatures of the night awaken and consume all living souls in their path. One day, when Thomas doesn't return home before sundown, Paul chooses to leave the safety of their fortified farm to find him before the creatures arrive. Just as he finds his boy, a nightmarish battle ensues and Paul is gravely wounded. Now the twins must devise a desperate plan for surviving the coming night and use everything their father has taught them to keep him alive.",Benjamin Brewer
horror,New Life,81,93,"Jess is a woman on the run, desperate to cross the Canadian border to escape her past. On her tail is Elsa, a resourceful agent, whose recent life-altering diagnosis leaves her one step behind. As their chase narrows to the mountains of the Pacific Northwest, holes in Elsa's investigation begin to fill with fresh bodies. Soon the pursuit spirals toward its harrowing confrontation between the two women, in search of meaning and redemption, on the razor's edge of catastrophe.",John Rosman
horror,Infested,71,96,"Kaleb is about to turn 30 and has never been lonelier. He's fighting with his sister over an inheritance and has cut ties with his best friend. Fascinated by exotic animals, he finds a venomous spider in a shop and brings it back to his apartment. It only takes a moment for the spider to escape and reproduce, turning the whole building into a dreadful web trap. The only option for Kaleb and his friends is to find a way out and survive.",Sébastien Vaniček
horror,Immaculate,60,73,"Sydney Sweeney (Anyone But You, Euphoria, The White Lotus) stars as Cecilia, an American nun of devout faith, embarking on a new journey in a remote convent in the picturesque Italian countryside. Cecilia's warm welcome quickly devolves into a nightmare as it becomes clear her new home harbors a sinister secret and unspeakable horrors.",Michael Mohan
horror,Rust Creek,61,86,"Sawyer is an ambitious, overachieving college senior who has a seemingly bright future. While on her way to a job interview, a wrong turn leaves her stranded deep in the frozen forest. Suddenly, the young woman who has everything to live for finds herself facing her own mortality as she's punished by the elements and pursued by a band of ruthless outlaws. With nowhere left to run, she is forced into an uneasy alliance with an enigmatic loner who has shadowy intentions.",Jen McGowan
horror,Barbarian,71,93,"Traveling to Detroit for a job interview, a young woman books a rental home. But when she arrives late at night, she discovers that the house is double booked and a strange man is already staying there. Against her better judgement, she decides to spend the evening, but soon discovers that there's a lot more to fear than just an unexpected house guest.",Zach Cregger
horror,Dream Scenario,68,91,"Hapless family man Paul Matthews (Nicolas Cage) finds his life turned upside down when millions of strangers suddenly start seeing him in their dreams. But when his nighttime appearances take a nightmarish turn, Paul is forced to navigate his newfound stardom, in this wickedly entertaining comedy from writer-director Kristoffer Borgli (Sick of Myself) and producer Ari Aster.",Kristoffer Borgli
horror,Talk to Me,82,95,"When a group of friends discover how to conjure spirits using an embalmed hand, they become hooked on the new thrill, until one of them goes too far and unleashes terrifying supernatural forces.","Danny Philippou, Michael Philippou"
horror,X,75,94,"In 1979, a group of young filmmakers set out to make an adult film in rural Texas, but when their reclusive, elderly hosts catch them in the act, the cast find themselves fighting for their lives.",Ti West
horror,You'll Never Find Me,68,79,"An isolated man living at the back of a desolate caravan park is visited by a desperate young woman seeking shelter from a violent storm. As the savage storm worsens, these solitary souls begin to feel threatened -- but who should really be afraid?","Josiah Allen, Indianna Bell"
horror,Out of Darkness,55,86,"A small boat reaches the shores of a raw and desolate landscape. A group of six have struggled across the narrow sea to find a new home. They are starving, desperate, and living 45,000 years ago. First they must find shelter, and they strike out across the tundra wastes towards the distant mountains that promise the abundant caves they need to survive. But when night falls, anticipation turns to fear and doubt as they realize they are not alone.",Andrew Cumming
horror,Alien,94,93,"In deep space, the crew of the commercial starship Nostromo is awakened from their cryo-sleep capsules halfway through their journey home to investigate a distress call from an alien vessel. The terror begins when the crew encounters a nest of eggs inside the alien ship. An organism from inside an egg leaps out and attaches itself to one of the crew, causing him to fall into a coma.",Ridley Scott
horror,When Evil Lurks,79,97,"When brothers Pedro (Ezequiel Rodríguez) and Jimmy (Demián Salomón) discover that a demonic infection has been festering in a nearby farmhouse -- its very proximity poisoning the local livestock -- they attempt to evict the victim from their land. Failing to adhere to the proper rites of exorcism, their reckless actions inadvertently trigger an epidemic of possessions across their rural community. Now they must outrun an encroaching evil as it corrupts and mutilates everyone it is exposed to, and enlist the aid of a wizened ""cleaner,"" who holds the only tools that can stop this supernatural plague.",Demián Rugna
horror,Stopmotion,49,90,A talented stop-motion animator becomes consumed by the grotesque world of her horrifying creations -- with deadly results.,Robert Morgan
horror,Five Nights at Freddy's,87,32,"The film follows a troubled security guard as he begins working at Freddy Fazbear's Pizza. While spending his first night on the job, he realizes the night shift at Freddy's won't be so easy to make it through.",Emma Tammi
horror,Night Swim,43,21,"Based on the acclaimed 2014 short film by Rod Blackhurst and Bryce McGuire, the film stars Wyatt Russell (The Falcon and the Winter Soldier) as Ray Waller, a former major league baseball player forced into early retirement by a degenerative illness, who moves into a new home with his concerned wife Eve (Oscar® nominee Kerry Condon, The Banshees of Inisherin), teenage daughter Izzy (Amélie Hoeferle, this fall's The Hunger Games: The Ballad of Songbirds and Snakes) and young son Elliot (Gavin Warren, Fear the Walking Dead). Secretly hoping, against the odds, to return to pro ball, Ray persuades Eve that the new home's shimmering backyard swimming pool will be fun for the kids and provide physical therapy for him. But a dark secret in the home's past will unleash a malevolent force that will drag the family under, into the depths of inescapable terror.",Bryce McGuire
horror,Imaginary,56,24,"From Blumhouse, the genre-defining masterminds behind FIVE NIGHTS AT FREDDY'S and M3GAN, comes an original horror that taps into the innocence of imaginary friends -- and begs the question: Are they really figments of childhood imagination or is something more terrifying lying just beneath? When Jessica (DeWanda Wise) moves back into her childhood home with her family, her youngest stepdaughter Alice (Pyper Braun) develops an eerie attachment to a stuffed bear named Chauncey she finds in the basement. Alice starts playing games with Chauncey that begin playful and become increasingly sinister. As Alice's behavior becomes more and more concerning, Jessica intervenes only to realize Chauncey is much more than the stuffed toy bear she believed him to be.",Jeff Wadlow
horror,His House,73,100,"A refugee couple makes a harrowing escape from war-torn South Sudan, but then they struggle to adjust to their new life in an English town that has an evil lurking beneath the surface.",Remi Weekes
horror,Men,39,69,"In the aftermath of a personal tragedy, Harper (Jessie Buckley) retreats alone to the beautiful English countryside, hoping to have found a place to heal. But someone or something from the surrounding woods appears to be stalking her. What begins as simmering dread becomes a fully-formed nightmare, inhabited by her darkest memories and fears in visionary filmmaker Alex Garland's (Ex Machina, Annihilation) feverish, shape-shifting new horror film.",Alex Garland
horror,The Dead Don't Die,38,55,"In the sleepy small town of Centerville, something is not quite right. The moon hangs large and low in the sky, the hours of daylight are becoming unpredictable, and animals are beginning to exhibit unusual behaviors. News reports are scary, and scientists are concerned, but no one foresees the strangest and most dangerous repercussion that will soon start plaguing Centerville: the dead rise from their graves and feast on the living, and the citizens must battle to survive.",Jim Jarmusch
romance,Mother of the Bride,23,19,Lana's daughter Emma returns from abroad and drops a bombshell: she's getting married. In Thailand. In a month! Things only get worse when Lana learns that the man who captured Emma's heart is the son of the man who broke hers years ago.,Mark Waters
romance,The Idea of You,69,83,"Based on the acclaimed, contemporary love story of the same name, The Idea of You centers on Solène (Anne Hathaway), a 40-year-old single mom who begins an unexpected romance with 24-year-old Hayes Campbell (Nicholas Galitzine), the lead singer of August Moon, the hottest boy band on the planet. When Solène must step in to chaperone her teenage daughter's trip to the Coachella Music Festival after her ex bails at the last minute, she has a chance encounter with Hayes and there is an instant, undeniable spark. As they begin a whirlwind romance, it isn't long before Hayes' superstar status poses unavoidable challenges to their relationship, and Solène soon discovers that life in the glare of his spotlight might be more than she bargained for.",Michael Showalter
romance,Turtles All the Way Down,94,86,"Turtles All the Way Down tackles anxiety through its 17-year-old protagonist, Aza Holmes. It's not easy being Aza, but she's trying... trying to be a good daughter, a good friend, and a good student, all while navigating an endless barrage of invasive, obsessive thoughts that she cannot control. When she reconnects with Davis, her childhood crush, Aza is confronted with fundamental questions about her potential for love, happiness, friendship, and hope.",Hannah Marks
romance,Anyone But You,87,54,"In the edgy comedy Anyone But You, Bea (Sydney Sweeney) and Ben (Glen Powell) look like the perfect couple, but after an amazing first date something happens that turns their fiery hot attraction ice cold -- until they find themselves unexpectedly thrust together at a destination wedding in Australia. So they do what any two mature adults would do: pretend to be a couple.",Will Gluck
