Genre,Title,Audience Score,Critics Score,Synopsis,Director
action,Kitty the Killer,,,"Dina, a highly trained teenage assassin, has worked with her mentor, Keng, for years. Together, they have been on countless missions and have always had each other's backs. However, their partnership is put to the test when Keng is betrayed by his own organization and left for dead. As Keng escapes, he meets Charlie, an ordinary office worker who he feels a special connection with. Keng sees potential in Charlie and decides to make him the new ""Grey Fox Guardian,"" a position that is tasked with protecting Dina from the organization that betrayed Keng. Charlie is thrust into a world he never knew existed, one filled with danger and constant threats to his and Dina's lives. Together, they must navigate the treacherous landscape of the assassin's world and stay one step ahead of their enemies. As they delve deeper into the organization's plans, they discover a sinister plot that could threaten the safety of millions. Charlie and Dina must work together to stop the organization before it's too late.",Lee Thongkham
action,The Ministry of Ungentlemanly Warfare,93,71,"Based upon recently declassified files of the British War Department and inspired by true events, THE MINISTRY OF UNGENTLEMANLY WARFARE is an action-comedy that tells the story of the first-ever special forces organization formed during WWII by UK Prime Minister Winston Churchill and a small group of military officials including author Ian Fleming. The top-secret combat unit, composed of a motley crew of rogues and mavericks, goes on a daring mission against the Nazis using entirely unconventional and utterly ""ungentlemanly"" fighting techniques. Ultimately their audacious approach changed the course of the war and laid the foundation for the British SAS and modern Black Ops warfare.",Guy Ritchie
action,Monkey Man,84,89,"Inspired by the legend of Hanuman, an icon embodying strength and courage, Monkey Man stars Dev Patel as Kid, an anonymous young man who ekes out a meager living in an underground fight club where, night after night, wearing a gorilla mask, he is beaten bloody by more popular fighters for cash. After years of suppressed rage, Kid discovers a way to infiltrate the enclave of the city's sinister elite. As his childhood trauma boils over, his mysteriously scarred hands unleash an explosive campaign of retribution to settle the score with the men who took everything from him.",Dev Patel
action,Arcadian,55,83,"In a near future, life on Earth has been decimated. Paul (Nicolas Cage) and his twin teenage sons, Thomas (Jaeden Martell) and Joseph (Maxwell Jenkins), have been living a half-life -- tranquility by day and torment by night. When the sun sets, ferocious creatures of the night awaken and consume all living souls in their path. One day, when Thomas doesn't return home before sundown, Paul chooses to leave the safety of their fortified farm to find him before the creatures arrive. Just as he finds his boy, a nightmarish battle ensues and Paul is gravely wounded. Now the twins must devise a desperate plan for surviving the coming night and use everything their father has taught them to keep him alive.",Benjamin Brewer
action,Love Lies Bleeding,82,94,"From Director Rose Glass comes an electric new love story; reclusive gym manager Lou falls hard for Jackie, an ambitious bodybuilder headed through town to Vegas in pursuit of her dream. But their love ignites violence, pulling them deep into the web of Lou's criminal family.",Rose Glass
action,War for the Planet of the Apes,84,94,"Caesar (Andy Serkis) and his apes are forced into a deadly conflict with an army of humans led by a ruthless colonel (Woody Harrelson). After the apes suffer unimaginable losses, Caesar wrestles with his darker instincts and begins his own mythic quest to avenge his kind. As the journey finally brings them face to face, Caesar and the colonel are pitted against each other in an epic battle that will determine the fate of both of their species and the future of the planet.",Matt Reeves
action,Dune: Part Two,95,92,"""Dune: Part Two"" will explore the mythic journey of Paul Atreides as he unites with Chani and the Fremen while on a warpath of revenge against the conspirators who destroyed his family. Facing a choice between the love of his life and the fate of the known universe, he endeavors to prevent a terrible future only he can foresee.",Denis Villeneuve
action,The Beekeeper,92,70,"In The Beekeeper, one man's brutal campaign for vengeance takes on national stakes after he is revealed to be a former operative of a powerful and clandestine organization known as ""Beekeepers"".",David Ayer
action,Dawn of the Planet of the Apes,88,91,"Ten years after simian flu wiped out much of the world's homosapiens, genetically enhanced chimpanzee Caesar (Andy Serkis) and his ever-growing band of followers have established a thriving colony just outside San Francisco in Muir Woods. Meanwhile, a small band of human survivors emerges, which forces Caesar -- as leader -- to grapple with the dual challenge of protecting his people and re-establishing a relationship with the remaining human population -- the latter being Caesar's secret wish.",Matt Reeves
action,In the Land of Saints and Sinners,75,83,"Ireland, 1970s. Eager to leave his dark past behind, Finbar Murphy (Liam Neeson) leads a quiet life in the remote coastal town of Glencolmcille, far from the political violence that grips the rest of the country. But when a menacing crew of terrorists arrive, led by a ruthless woman named Doirean (Kerry Condon), Finbar is drawn into an increasingly vicious game of cat and mouse, forcing him to choose between exposing his secret identity or defending his friends and neighbors.",Robert Lorenz
action,Argylle,72,33,"Bryce Dallas Howard (Jurassic World franchise) is Elly Conway, the reclusive author of a series of best-selling espionage novels, whose idea of bliss is a night at home with her computer and her cat, Alfie. But when the plots of Elly's fictional books--which center on secret agent Argylle and his mission to unravel a global spy syndicate--begin to mirror the covert actions of a real-life spy organization, quiet evenings at home become a thing of the past. Accompanied by Aidan (Oscar® winner Sam Rockwell), a cat-allergic spy, Elly (carrying Alfie in her backpack) races across the world to stay one step ahead of the killers as the line between Elly's fictional world and her real one begins to blur.",Matthew Vaughn
action,Kung Fu Panda 4,87,72,"After three death-defying adventures defeating world-class villains with his unmatched courage and mad martial arts skills, Po, the Dragon Warrior (Golden Globe nominee Jack Black), is called upon by destiny to... give it a rest already. More specifically, he's tapped to become the Spiritual Leader of the Valley of Peace. That poses a couple of obvious problems. First, Po knows as much about spiritual leadership as he does about the paleo diet, and second, he needs to quickly find and train a new Dragon Warrior before he can assume his new lofty position. Even worse, there's been a recent sighting of a wicked, powerful sorceress, Chameleon (Oscar® winner Viola Davis), a tiny lizard who can shapeshift into any creature, large or small. And Chameleon has her greedy, beady little eyes on Po's Staff of Wisdom, which would give her the power to re-summon all the master villains whom Po has vanquished to the spirit realm. So, Po’s going to need some help. He finds it (kinda?) in the form of crafty, quick-witted thief Zhen (Golden Globe winner Awkwafina), a corsac fox who really gets under Po’s fur but whose skills will prove invaluable. In their quest to protect the Valley of Peace from Chameleon’s reptilian claws, this comedic odd-couple duo will have to work together. In the process, Po will discover that heroes can be found in the most unexpected places.",Mike Mitchell
action,The Great Wall,42,35,"When a mercenary warrior (Matt Damon) is imprisoned within the Great Wall, he discovers the mystery behind one of the greatest wonders of the world. As wave after wave of marauding beasts besiege the massive structure, his quest for fortune turns into a journey toward heroism as he joins a huge army of elite warriors to confront the unimaginable and seemingly unstoppable force.",Yimou Zhang
action,Star Wars: Episode I - The Phantom Menace,59,52,"Experience the heroic action and unforgettable adventures of Star Wars: Episode I - The Phantom Menace. See the first fateful steps in the journey of Anakin Skywalker. Stranded on the desert planet Tatooine after rescuing young Queen Amidala from the impending invasion of Naboo, Jedi apprentice Obi-Wan Kenobi and his Jedi Master Qui-Gon Jinn discover nine-year-old Anakin, who is unusually strong in the Force. Anakin wins a thrilling Podrace and with it his freedom as he leaves his home to be trained as a Jedi. The heroes return to Naboo where Anakin and the Queen face massive invasion forces while the two Jedi contend with a deadly foe named Darth Maul. Only then do they realize the invasion is merely the first step in a sinister scheme by the re-emergent forces of darkness known as the Sith. After the feature, fans will also get a special first look at Star Wars: The Acolyte series coming to Disney+ June 2024.",George Lucas
action,Bullet Train,76,54,"In Bullet Train, Brad Pitt stars as Ladybug, an unlucky assassin determined to do his job peacefully after one too many gigs gone off the rails. Fate, however, may have other plans, as Ladybug's latest mission puts him on a collision course with lethal adversaries from around the globe -- all with connected, yet conflicting, objectives -- on the world's fastest train. From the director of Deadpool 2, David Leitch, the end of the line is only the beginning in a wild, non-stop thrill ride through modern-day Japan.",David Leitch
action,Rebel Moon: Part Two - The Scargiver,49,16,"The rebel warriors gear up for battle against the ruthless forces of the Motherworld as unbreakable bonds are forged, heroes emerge — and legends are made.",Zack Snyder
action,Madame Web,57,11,"In a switch from the typical genre, Madame Web tells the standalone origin story of one of Marvel publishing's most enigmatic heroines. The suspense-driven thriller stars Dakota Johnson as Cassandra Webb, a paramedic in Manhattan who develops the power to see the future... and realizes she can use that insight to change it. Forced to confront revelations about her past, she forges a relationship with three young women bound for powerful destinies... if they can all survive a deadly present.",S.J. Clarkson
action,Rebel Moon: Part One - A Child of Fire,57,21,"From Zack Snyder, the filmmaker behind 300, Man of Steel, and Army of the Dead, comes REBEL MOON, an epic science-fantasy event decades in the making. When a peaceful colony on the edge of a galaxy finds itself threatened by the armies of a tyrannical ruling force, Kora (Sofia Boutella), a mysterious stranger living among the villagers, becomes their best hope for survival. Tasked with finding trained fighters who will unite with her in making an impossible stand against the Mother World, Kora assembles a small band of warriors -- outsiders, insurgents, peasants and orphans of war from different worlds who share a common need for redemption and revenge. As the shadow of an entire Realm bears down on the unlikeliest of moons, a battle over the fate of a galaxy is waged, and in the process, a new army of heroes is formed.",Zack Snyder
action,The Iron Claw,94,89,"The true story of the inseparable Von Erich brothers, who made history in the intensely competitive world of professional wrestling in the early 1980s. Through tragedy and triumph, under the shadow of their domineering father and coach, the brothers seek larger-than-life immortality on the biggest stage in sports.",Sean Durkin
action,Planet of the Apes,27,43,"Director Tim Burton (""Batman"") reinvents one of the most acclaimed and beloved works of science fiction, Pierre Boulle's classic novel ""Planet of the Apes."" Burton's ""Planet of the Apes"" begins with the famed original's premise -- a pilot finds himself in a world turned upside down after landing on a strange planet.",Tim Burton
action,Land of Bad,94,64,"Starring Russell Crowe and Liam Hemsworth, a covert Special Forces operation in the South Philippines spirals into a brutal 48-hour battle for survival. When an elite extraction team is ambushed deep in enemy territory, rookie officer Kinney (Hemsworth) is left outnumbered but determined to leave no man behind. With an air strike closing in, Kinney's only hope hinges on the guidance of Air Force drone pilot Reaper (Crowe), navigating unknowable danger where every move could be their last.",William Eubank
action,Chief of Station,89,,"Ben is a former CIA station chief whose world comes crashing down after his wife, a former operative, dies in a terrible accident. Soon, a cryptic message sends him back into the shadowy underworld of Eastern Europe, teaming up with a former adversary to unravel a conspiracy that challenges everything he thought he knew about his wife and the agency that he worked for.",Jesse V. Johnson
action,Road House,53,59,"In this adrenaline-fueled reimagining of the 80s cult classic, ex-UFC fighter Dalton (Jake Gyllenhaal) takes a job as a bouncer at a Florida Keys roadhouse, only to discover that this paradise is not all it seems.",Doug Liman
action,3 Days in Malay,86,,"Inspired by a true story, Marines stationed at an airfield in Malay during WWII get wind of a coming raid by the Japanese. Unable to get reinforcements approved, they engage in a harrowing 3-day battle against enemy forces.",Louis Mandylor
action,Mad Max: Fury Road,86,97,"Years after the collapse of civilization, the tyrannical Immortan Joe enslaves apocalypse survivors inside the desert fortress the Citadel. When the warrior Imperator Furiosa (Charlize Theron) leads the despot's five wives in a daring escape, she forges an alliance with Max Rockatansky (Tom Hardy), a loner and former captive. Fortified in the massive, armored truck the War Rig, they try to outrun the ruthless warlord and his henchmen in a deadly high-speed chase through the Wasteland.",George Miller
action,The Amazing Spider-Man,77,71,"Abandoned by his parents and raised by an aunt and uncle, teenager Peter Parker (Andrew Garfield), AKA Spider-Man, is trying to sort out who he is and exactly what his feelings are for his first crush, Gwen Stacy (Emma Stone). When Peter finds a mysterious briefcase that was his father's, he pursues a quest to solve his parents' disappearance. His search takes him to Oscorp and the lab of Dr. Curt Connors (Rhys Ifans), setting him on a collision course with Connors' alter ego, the Lizard.",Marc Webb
action,Dune,90,83,"Paul Atreides, a brilliant and gifted young man born into a great destiny beyond his understanding, must travel to the most dangerous planet in the universe to ensure the future of his family and his people. As malevolent forces explode into conflict over the planet's exclusive supply of the most precious resource in existence, only those who can conquer their own fear will survive.",Denis Villeneuve
adventure,Ghostbusters: Frozen Empire,83,43,"In Ghostbusters: Frozen Empire, the Spengler family returns to where it all started -- the iconic New York City firehouse -- to team up with the original Ghostbusters, who've developed a top-secret research lab to take busting ghosts to the next level. But when the discovery of an ancient artifact unleashes an evil force, Ghostbusters new and old must join forces to protect their home and save the world from a second Ice Age.",Gil Kenan
adventure,War for the Planet of the Apes,84,94,"Caesar (Andy Serkis) and his apes are forced into a deadly conflict with an army of humans led by a ruthless colonel (Woody Harrelson). After the apes suffer unimaginable losses, Caesar wrestles with his darker instincts and begins his own mythic quest to avenge his kind. As the journey finally brings them face to face, Caesar and the colonel are pitted against each other in an epic battle that will determine the fate of both of their species and the future of the planet.",Matt Reeves
adventure,Dune: Part Two,95,92,"""Dune: Part Two"" will explore the mythic journey of Paul Atreides as he unites with Chani and the Fremen while on a warpath of revenge against the conspirators who destroyed his family. Facing a choice between the love of his life and the fate of the known universe, he endeavors to prevent a terrible future only he can foresee.",Denis Villeneuve
adventure,Dawn of the Planet of the Apes,88,91,"Ten years after simian flu wiped out much of the world's homosapiens, genetically enhanced chimpanzee Caesar (Andy Serkis) and his ever-growing band of followers have established a thriving colony just outside San Francisco in Muir Woods. Meanwhile, a small band of human survivors emerges, which forces Caesar -- as leader -- to grapple with the dual challenge of protecting his people and re-establishing a relationship with the remaining human population -- the latter being Caesar's secret wish.",Matt Reeves
adventure,Arthur the King,97,69,"Over the course of ten days and 435 miles, an unbreakable bond is forged between pro adventure racer Michael Light (Mark Wahlberg) and a scrappy street dog companion dubbed Arthur. Based on an incredible true story, ARTHUR THE KING follows Light, desperate for one last chance to win, as he convinces a sponsor to back him and a team of athletes (Simu Liu, Nathalie Emmanuel, and Ali Suliman) for the Adventure Racing World Championship in the Dominican Republic. As the team is pushed to their outer limits of endurance in the race, Arthur redefines what victory, loyalty and friendship truly mean.",Simon Cellan Jones
adventure,Argylle,72,33,"Bryce Dallas Howard (Jurassic World franchise) is Elly Conway, the reclusive author of a series of best-selling espionage novels, whose idea of bliss is a night at home with her computer and her cat, Alfie. But when the plots of Elly's fictional books--which center on secret agent Argylle and his mission to unravel a global spy syndicate--begin to mirror the covert actions of a real-life spy organization, quiet evenings at home become a thing of the past. Accompanied by Aidan (Oscar® winner Sam Rockwell), a cat-allergic spy, Elly (carrying Alfie in her backpack) races across the world to stay one step ahead of the killers as the line between Elly's fictional world and her real one begins to blur.",Matthew Vaughn
adventure,Kung Fu Panda 4,87,72,"After three death-defying adventures defeating world-class villains with his unmatched courage and mad martial arts skills, Po, the Dragon Warrior (Golden Globe nominee Jack Black), is called upon by destiny to... give it a rest already. More specifically, he's tapped to become the Spiritual Leader of the Valley of Peace. That poses a couple of obvious problems. First, Po knows as much about spiritual leadership as he does about the paleo diet, and second, he needs to quickly find and train a new Dragon Warrior before he can assume his new lofty position. Even worse, there's been a recent sighting of a wicked, powerful sorceress, Chameleon (Oscar® winner Viola Davis), a tiny lizard who can shapeshift into any creature, large or small. And Chameleon has her greedy, beady little eyes on Po's Staff of Wisdom, which would give her the power to re-summon all the master villains whom Po has vanquished to the spirit realm. So, Po’s going to need some help. He finds it (kinda?) in the form of crafty, quick-witted thief Zhen (Golden Globe winner Awkwafina), a corsac fox who really gets under Po’s fur but whose skills will prove invaluable. In their quest to protect the Valley of Peace from Chameleon’s reptilian claws, this comedic odd-couple duo will have to work together. In the process, Po will discover that heroes can be found in the most unexpected places.",Mike Mitchell
adventure,The Great Wall,42,35,"When a mercenary warrior (Matt Damon) is imprisoned within the Great Wall, he discovers the mystery behind one of the greatest wonders of the world. As wave after wave of marauding beasts besiege the massive structure, his quest for fortune turns into a journey toward heroism as he joins a huge army of elite warriors to confront the unimaginable and seemingly unstoppable force.",Yimou Zhang
adventure,Star Wars: Episode I - The Phantom Menace,59,52,"Experience the heroic action and unforgettable adventures of Star Wars: Episode I - The Phantom Menace. See the first fateful steps in the journey of Anakin Skywalker. Stranded on the desert planet Tatooine after rescuing young Queen Amidala from the impending invasion of Naboo, Jedi apprentice Obi-Wan Kenobi and his Jedi Master Qui-Gon Jinn discover nine-year-old Anakin, who is unusually strong in the Force. Anakin wins a thrilling Podrace and with it his freedom as he leaves his home to be trained as a Jedi. The heroes return to Naboo where Anakin and the Queen face massive invasion forces while the two Jedi contend with a deadly foe named Darth Maul. Only then do they realize the invasion is merely the first step in a sinister scheme by the re-emergent forces of darkness known as the Sith. After the feature, fans will also get a special first look at Star Wars: The Acolyte series coming to Disney+ June 2024.",George Lucas
adventure,Rebel Moon: Part Two - The Scargiver,49,16,"The rebel warriors gear up for battle against the ruthless forces of the Motherworld as unbreakable bonds are forged, heroes emerge — and legends are made.",Zack Snyder
adventure,Madame Web,57,11,"In a switch from the typical genre, Madame Web tells the standalone origin story of one of Marvel publishing's most enigmatic heroines. The suspense-driven thriller stars Dakota Johnson as Cassandra Webb, a paramedic in Manhattan who develops the power to see the future... and realizes she can use that insight to change it. Forced to confront revelations about her past, she forges a relationship with three young women bound for powerful destinies... if they can all survive a deadly present.",S.J. Clarkson
adventure,The Peanut Butter Falcon,96,95,"After running away from a residential nursing home to pursue his dream of becoming a pro wrestler, a man who has Down syndrome befriends an outlaw who becomes his coach and ally.","Tyler Nilson, Michael Schwartz"
adventure,Rebel Moon: Part One - A Child of Fire,57,21,"From Zack Snyder, the filmmaker behind 300, Man of Steel, and Army of the Dead, comes REBEL MOON, an epic science-fantasy event decades in the making. When a peaceful colony on the edge of a galaxy finds itself threatened by the armies of a tyrannical ruling force, Kora (Sofia Boutella), a mysterious stranger living among the villagers, becomes their best hope for survival. Tasked with finding trained fighters who will unite with her in making an impossible stand against the Mother World, Kora assembles a small band of warriors -- outsiders, insurgents, peasants and orphans of war from different worlds who share a common need for redemption and revenge. As the shadow of an entire Realm bears down on the unlikeliest of moons, a battle over the fate of a galaxy is waged, and in the process, a new army of heroes is formed.",Zack Snyder
adventure,Planet of the Apes,27,43,"Director Tim Burton (""Batman"") reinvents one of the most acclaimed and beloved works of science fiction, Pierre Boulle's classic novel ""Planet of the Apes."" Burton's ""Planet of the Apes"" begins with the famed original's premise -- a pilot finds himself in a world turned upside down after landing on a strange planet.",Tim Burton
adventure,Wish,81,48,"Walt Disney Animation Studios' ""Wish"" is an all-new musical-comedy welcoming audiences to the magical kingdom of Rosas, where Asha, a sharp-witted idealist, makes a wish so powerful that it is answered by a cosmic force--a little ball of boundless energy called Star. Together, Asha and Star confront a most formidable foe--the ruler of Rosas, King Magnifico--to save her community and prove that when the will of one courageous human connects with the magic of the stars, wondrous things can happen.","Chris Buck, Fawn Veerasunthorn"
adventure,Planet of the Apes,88,86,"Complex sociological themes run through this science-fiction classic about three astronauts marooned on a futuristic planet where apes rule and humans are slaves. The stunned trio discovers that these highly intellectual simians can both walk upright and talk. They have even established a class system and a political structure. The astronauts suddenly find themselves part of a devalued species, trapped and imprisoned by the apes.",Franklin J. Schaffner
adventure,Mad Max: Fury Road,86,97,"Years after the collapse of civilization, the tyrannical Immortan Joe enslaves apocalypse survivors inside the desert fortress the Citadel. When the warrior Imperator Furiosa (Charlize Theron) leads the despot's five wives in a daring escape, she forges an alliance with Max Rockatansky (Tom Hardy), a loner and former captive. Fortified in the massive, armored truck the War Rig, they try to outrun the ruthless warlord and his henchmen in a deadly high-speed chase through the Wasteland.",George Miller
